{
  "positionProfileId": "TP-ARC-001",
  "trainId": "TRN-001",
  "referenceLineType": "TRACK_CENTERLINE",
  "stepLength": 5,
  "startStation": 0,
  "endStation": 50,
  "repeatLength": 82,
  "positions": [
    { "positionId": "P-000", "headStation": 0, "tailStation": -82 },
    { "positionId": "P-005", "headStation": 5, "tailStation": -77 },
    { "positionId": "P-010", "headStation": 10, "tailStation": -72 },
    { "positionId": "P-015", "headStation": 15, "tailStation": -67 }
  ]
}
